{
  "messageId": "11111111-1111-4111-8111-111111111122",
  "messageType": "SearchPerformed",
  "version": 1,
  "producer": "InventoryService",
  "occurredAt": "2026-10-19T10:04:00Z",
  "correlationId": "corr-search-002",
  "payload": {
    "userId": "22222222-2222-4222-8222-222222222222",
    "equipmentTypeId": null
  }
}
