{
  "messageId": "55555555-5555-4555-8555-555555555555",
  "messageType": "SearchPerformed",
  "version": 1,
  "producer": "InventoryService",
  "occurredAt": "2026-10-19T10:01:00.0000000Z",
  "correlationId": "55555555-5555-4555-8555-555555555555",
  "aggregateId": "55555555-5555-4555-8555-555555555555",
  "payload": {
    "userId": "22222222-2222-4222-8222-222222222222",
    "equipmentTypeId": null,
    "query": "máy khoan",
    "categoryId": null,
    "filterContext": {
      "brandId": null,
      "provinceCode": null,
      "wardCode": null,
      "sort": null,
      "filters": null,
      "from": null,
      "to": null,
      "requestedQuantity": null,
      "page": 1,
      "pageSize": 20
    },
    "resultCount": 37
  }
}
